{
  "schemaVersion": 1,
  "generatedAt": "2026-04-03T07:49:48.665Z",
  "congressMap": {
    "congress_core": {
      "id": "congress_core",
      "name": "Indian National Congress Network",
      "type": "root",
      "desc": "Core Congress network around the party, Young Indian, AJL, National Herald, and the Gandhi family.",
      "founded": 1885,
      "hq": "New Delhi",
      "subsidiaries": 4,
      "govtLinks": 0,
      "globalExposure": 3,
      "marketCap": "N/A",
      "riskLevel": "HIGH",
      "nodes": [
        {
          "id": "inc",
          "label": "Indian National Congress",
          "type": "root",
          "size": 28,
          "desc": "National political party founded in 1885. Root node for the network."
        },
        {
          "id": "young",
          "label": "Young Indian",
          "type": "sub",
          "size": 18,
          "desc": "Section 25 not-for-profit company floated by Sonia and Rahul Gandhi."
        },
        {
          "id": "ajl",
          "label": "Associated Journals",
          "type": "sub",
          "size": 16,
          "desc": "Company that owns National Herald assets."
        },
        {
          "id": "herald",
          "label": "National Herald",
          "type": "sub",
          "size": 14,
          "desc": "Congress-affiliated newspaper publication."
        },
        {
          "id": "rahul",
          "label": "Rahul Gandhi",
          "type": "person",
          "size": 18,
          "desc": "Congress leader; former party president."
        },
        {
          "id": "sonia",
          "label": "Sonia Gandhi",
          "type": "person",
          "size": 18,
          "desc": "Former party president; Rajya Sabha MP."
        },
        {
          "id": "kharge",
          "label": "Mallikarjun Kharge",
          "type": "person",
          "size": 16,
          "desc": "Current Congress President."
        },
        {
          "id": "priyanka",
          "label": "Priyanka Gandhi Vadra",
          "type": "person",
          "size": 16,
          "desc": "Congress General Secretary."
        },
        {
          "id": "motilal",
          "label": "Motilal Vora",
          "type": "person",
          "size": 14,
          "desc": "Former treasurer; chairman and MD of AJL."
        },
        {
          "id": "oscar",
          "label": "Oscar Fernandes",
          "type": "person",
          "size": 14,
          "desc": "Senior Congress leader and Young Indian shareholder."
        },
        {
          "id": "suman",
          "label": "Suman Dubey",
          "type": "person",
          "size": 13,
          "desc": "Managing committee member at Young Indian."
        },
        {
          "id": "sam",
          "label": "Sam Pitroda",
          "type": "person",
          "size": 13,
          "desc": "Technocrat and Young Indian director."
        },
        {
          "id": "backops",
          "label": "Backops Services",
          "type": "sub",
          "size": 12,
          "desc": "Business entity founded by Rahul Gandhi."
        },
        {
          "id": "rgf",
          "label": "Rajiv Gandhi Foundation",
          "type": "sub",
          "size": 12,
          "desc": "Charitable trust linked to Rahul Gandhi."
        },
        {
          "id": "rgct",
          "label": "Rajiv Gandhi Charitable Trust",
          "type": "sub",
          "size": 12,
          "desc": "Charitable trust linked to Rahul Gandhi."
        },
        {
          "id": "sgb",
          "label": "Sovereign Gold Bonds",
          "type": "global",
          "size": 12,
          "desc": "Government securities held by Rahul Gandhi."
        },
        {
          "id": "gurugram",
          "label": "Gurugram Property",
          "type": "global",
          "size": 12,
          "desc": "Commercial property owned by Rahul Gandhi."
        },
        {
          "id": "agri",
          "label": "Agricultural Properties",
          "type": "global",
          "size": 12,
          "desc": "Co-owned agricultural properties with Priyanka Gandhi Vadra."
        },
        {
          "id": "nheraldcase",
          "label": "National Herald Case",
          "type": "flag",
          "size": 14,
          "desc": "Controversy around AJL, Young Indian, and National Herald control."
        }
      ],
      "links": [
        {
          "source": "inc",
          "target": "young",
          "type": "control"
        },
        {
          "source": "inc",
          "target": "ajl",
          "type": "owns"
        },
        {
          "source": "ajl",
          "target": "herald",
          "type": "subsidiary"
        },
        {
          "source": "inc",
          "target": "nheraldcase",
          "type": "controversy"
        },
        {
          "source": "young",
          "target": "nheraldcase",
          "type": "controversy"
        },
        {
          "source": "rahul",
          "target": "young",
          "type": "control"
        },
        {
          "source": "sonia",
          "target": "young",
          "type": "control"
        },
        {
          "source": "kharge",
          "target": "young",
          "type": "control"
        },
        {
          "source": "priyanka",
          "target": "agri",
          "type": "investment"
        },
        {
          "source": "rahul",
          "target": "backops",
          "type": "owns"
        },
        {
          "source": "rahul",
          "target": "rgf",
          "type": "partner"
        },
        {
          "source": "rahul",
          "target": "rgct",
          "type": "partner"
        },
        {
          "source": "rahul",
          "target": "sgb",
          "type": "investment"
        },
        {
          "source": "rahul",
          "target": "gurugram",
          "type": "investment"
        },
        {
          "source": "rahul",
          "target": "agri",
          "type": "investment"
        },
        {
          "source": "motilal",
          "target": "ajl",
          "type": "control"
        },
        {
          "source": "motilal",
          "target": "young",
          "type": "subsidiary"
        },
        {
          "source": "oscar",
          "target": "young",
          "type": "subsidiary"
        },
        {
          "source": "suman",
          "target": "young",
          "type": "control"
        },
        {
          "source": "sam",
          "target": "young",
          "type": "control"
        }
      ],
      "alerts": [
        {
          "level": "high",
          "title": "Young Indian Structure",
          "text": "Congress network centered on Young Indian, AJL, and National Herald; several leaders appear across the same control chain."
        },
        {
          "level": "medium",
          "title": "Family Ties",
          "text": "Rahul, Sonia, and Priyanka nodes converge around trusts, assets, and Young Indian."
        },
        {
          "level": "medium",
          "title": "Press Asset",
          "text": "National Herald node retained to preserve the historical AJL ownership chain."
        }
      ]
    },
    "money_trail": {
      "id": "money_trail",
      "name": "Congress Wealth Network",
      "type": "person",
      "desc": "Affidavit-driven assets, portfolios, properties, and wealth disclosures across prominent Congress-linked leaders.",
      "founded": 2024,
      "hq": "Delhi / Nationwide",
      "subsidiaries": 6,
      "govtLinks": 0,
      "globalExposure": 3,
      "marketCap": "N/A",
      "riskLevel": "MEDIUM",
      "nodes": [
        {
          "id": "abhishek",
          "label": "Abhishek Manu Singhvi",
          "type": "root",
          "size": 24,
          "desc": "Rajya Sabha MP and senior advocate; major wealth disclosure node."
        },
        {
          "id": "listed",
          "label": "Listed Shares",
          "type": "global",
          "size": 16,
          "desc": "Declared listed shares worth approx Rs.190.82 crore."
        },
        {
          "id": "mutuals",
          "label": "Mutual Funds",
          "type": "global",
          "size": 15,
          "desc": "Declared mutual funds worth Rs.197.87 crore."
        },
        {
          "id": "unlisted",
          "label": "Unlisted Shares",
          "type": "global",
          "size": 14,
          "desc": "Declared unlisted shares worth Rs.33 crore."
        },
        {
          "id": "loans",
          "label": "Personal Loans Extended",
          "type": "global",
          "size": 14,
          "desc": "Extended personal loans of approx Rs.353.32 crore."
        },
        {
          "id": "art",
          "label": "Artwork & Paintings",
          "type": "global",
          "size": 13,
          "desc": "Valued at over Rs.25 crore."
        },
        {
          "id": "jewel_self",
          "label": "Jewellery - Self",
          "type": "global",
          "size": 12,
          "desc": "Valued at Rs.2.40 crore."
        },
        {
          "id": "jewel_spouse",
          "label": "Jewellery - Spouse",
          "type": "global",
          "size": 12,
          "desc": "Valued at Rs.157.53 crore."
        },
        {
          "id": "neeti",
          "label": "Neeti Bagh",
          "type": "global",
          "size": 12,
          "desc": "Residential property valued at Rs.20 crore."
        },
        {
          "id": "sunder",
          "label": "Sunder Nagar",
          "type": "global",
          "size": 12,
          "desc": "Residential property valued at Rs.35 crore."
        },
        {
          "id": "alibaug",
          "label": "Alibaug Land",
          "type": "global",
          "size": 12,
          "desc": "Agricultural land valued at Rs.5 crore."
        },
        {
          "id": "mercedes",
          "label": "Mercedes-Benz",
          "type": "global",
          "size": 11,
          "desc": "Vehicle worth Rs.1.7 crore."